videoId,textDisplay,textOriginal,parentId,authorDisplayName,authorProfileImageUrl,authorChannelUrl,authorChannelId,canRate,viewerRating,likeCount,publishedAt,updatedAt,comment_id
ot3k3k_FTgU,Nocturne in E-flat major is the best nocturne,Nocturne in E-flat major is the best nocturne,Ruben Unedo Hamonangan Sianipar,https://yt3.ggpht.com/ytc/AGIKgqOkljqKaDShJ9t68seAEXgFWNxbcpDtSn940ubi=s48-c-k-c0x00ffffff-no-rj,http://www.youtube.com/channel/UCJHugEohI9rXyI4Bt5hLeKg,{'value': 'UCJHugEohI9rXyI4Bt5hLeKg'},True,none,0,2023-02-19T16:15:40Z,2023-02-19T16:15:40Z,,UgwOX3jX6URhQ21GwNB4AaABAg
ot3k3k_FTgU,"sublime composición , gracias por tu complicidad","sublime composición , gracias por tu complicidad",José garcía,https://yt3.ggpht.com/ytc/AGIKgqP9Y6n4SSY52661b0MbT0Yuwm0ECwVfx-u5DUAKrg=s48-c-k-c0x00ffffff-no-rj,http://www.youtube.com/channel/UCDJJuTlKuZfSTwQN_D0IvBQ,{'value': 'UCDJJuTlKuZfSTwQN_D0IvBQ'},True,none,0,2023-02-19T16:12:16Z,2023-02-19T16:12:16Z,,UgxFMYmv4pbqC6esuR94AaABAg
ot3k3k_FTgU,"Four in the history of music who received the Medal of Artistic Merit from France, or the so-called Medal of Eternity, are Chopin, Mozart, Beethoven and Farid al-Atrash.","Four in the history of music who received the Medal of Artistic Merit from France, or the so-called Medal of Eternity, are Chopin, Mozart, Beethoven and Farid al-Atrash.",Le Pêcheur,https://yt3.ggpht.com/ytc/AGIKgqNwqjFVBwN_kllnuhtBPqbXY1KtbDj7CjwVJ9JpZw=s48-c-k-c0x00ffffff-no-rj,http://www.youtube.com/channel/UCZZU0_IbzmjUqfDQ0LyTYCw,{'value': 'UCZZU0_IbzmjUqfDQ0LyTYCw'},True,none,0,2023-02-19T13:28:53Z,2023-02-19T13:28:53Z,,UgyT1IIpm3pPiCNI7tB4AaABAg
ot3k3k_FTgU,Splendido!,Splendido!,Maria Poldelmengo,https://yt3.ggpht.com/ytc/AGIKgqONxTP7wUpYT1ZLu4-tMnmh5StcrI_Wb4-CJw=s48-c-k-c0x00ffffff-no-rj,http://www.youtube.com/channel/UCN4z5hWBhF6AeIuRfwwteLw,{'value': 'UCN4z5hWBhF6AeIuRfwwteLw'},True,none,1,2023-02-19T12:56:33Z,2023-02-19T12:56:33Z,,Ugx7KitRf5SXbf5wYI14AaABAg
ot3k3k_FTgU,Working on it! 👍,Working on it! 👍,Classical Oasis,https://yt3.ggpht.com/JS7TE4cCbhWgK6E1qAbbQecDqgYh_FzdykaknewcLqlRaTBZN4ECPUB0cjnvxZ0o5dKZRRI-=s48-c-k-c0x00ffffff-no-rj,http://www.youtube.com/channel/UCzo-s-TNyLPq41bW7VUDQ0w,{'value': 'UCzo-s-TNyLPq41bW7VUDQ0w'},True,none,1,2023-02-24T06:18:53Z,2023-02-24T06:18:53Z,,UgxVBsJZ9dw-MCzE0QB4AaABAg.9mJMeyDpNI89mVjUmvB6-i
ot3k3k_FTgU,Why does he look like a zombie?,Why does he look like a zombie?,George Stanfo,https://yt3.ggpht.com/ytc/AGIKgqP_gWOeMFGKylRSewWmoTgQFPA3QEetouVTBw=s48-c-k-c0x00ffffff-no-rj,http://www.youtube.com/channel/UCS9H3Ay1MS_DF4hiCw5fpzQ,{'value': 'UCS9H3Ay1MS_DF4hiCw5fpzQ'},True,none,1,2023-02-19T02:03:00Z,2023-02-19T02:03:00Z,,UgwN21x-eAZdVDp3tMt4AaABAg
ot3k3k_FTgU,Chopin e sua bela melancolia,Chopin e sua bela melancolia,joe Grehmily,https://yt3.ggpht.com/ytc/AGIKgqOsuMY3gCnyW8aMV2szRp8h2wgUYbN2ZhWieFGbv811OSIri58HujA1esYB_yEC=s48-c-k-c0x00ffffff-no-rj,http://www.youtube.com/channel/UCfLmV2WhgPcwcl3gasd5gNw,{'value': 'UCfLmV2WhgPcwcl3gasd5gNw'},True,none,3,2023-02-19T01:15:22Z,2023-02-19T01:15:22Z,,UgwWGu9PyfpYJbEtk_N4AaABAg
ot3k3k_FTgU,"Marco Baroni, a potomu, chto uze mesto zanjto, w sowremennom mire uze budet ne ta muzika.","Marco Baroni, a potomu, chto uze mesto zanjto, w sowremennom mire uze budet ne ta muzika.",Елена Prekrasnaja,https://yt3.ggpht.com/A_iSYeZZ645ovUbWhXnOiaDMPmVRFxqpyGZVhXoW1IXs9LdALad7WVu89SLSHl1oqMe7QBIkUA=s48-c-k-c0x00ffffff-no-rj,http://www.youtube.com/channel/UCSgEtA4FwY2nwF3W-b132jQ,{'value': 'UCSgEtA4FwY2nwF3W-b132jQ'},True,none,0,2023-03-29T21:13:50Z,2023-03-29T21:13:50Z,,UgwxWRda1mDhCaqUwZB4AaABAg.9mHO8rJqdrF9nrJ8_-ytrD
ot3k3k_FTgU,"Very nice, I like.","Very nice, I like.",soup,https://yt3.ggpht.com/4i6o7d6_4yX0dDddlCbOFDrjfbtMwDMJQDwd4m6t1qeJE4nbWTLr8xEclbcnAm7WZCgI_rrW=s48-c-k-c0x00ffffff-no-rj,http://www.youtube.com/channel/UCPWUHpZiCPCLRp431mhAO2Q,{'value': 'UCPWUHpZiCPCLRp431mhAO2Q'},True,none,2,2023-02-18T13:10:04Z,2023-02-18T13:10:04Z,,Ugzc3YFOFrjW8iqRoH54AaABAg
ot3k3k_FTgU,"The best, I love it.","The best, I love it.",MAVIS CLAUDIA LOZANO - MARTINEZ,https://yt3.ggpht.com/7_yV7-Vy_mwDcYPl0fQz1-c7UjeNxJBKv3IFmf5ef_3PPvKXBHqmR5Ey1bDiU_FcJ-lzuUE9gA=s48-c-k-c0x00ffffff-no-rj,http://www.youtube.com/channel/UCmBKkqScMvABZZi8d1_PAwA,{'value': 'UCmBKkqScMvABZZi8d1_PAwA'},True,none,3,2023-02-18T06:13:32Z,2023-02-18T06:13:32Z,,UgyiqZT51cswzKtaaEF4AaABAg
ot3k3k_FTgU,Không hiểu sao ngay nốt nhạc đầu tiên tôi nhớ tới người mẹ của mình,Không hiểu sao ngay nốt nhạc đầu tiên tôi nhớ tới người mẹ của mình,Hang Vu,https://yt3.ggpht.com/ytc/AGIKgqPkf02uW85LLkmmFj4G8hyBfXiYAbyYEQI9EMBrwg=s48-c-k-c0x00ffffff-no-rj,http://www.youtube.com/channel/UCbDaM_klNvhtXp3Xqh0uMLg,{'value': 'UCbDaM_klNvhtXp3Xqh0uMLg'},True,none,1,2023-02-18T05:50:10Z,2023-02-18T05:50:10Z,,UgxCJwWBc9W85Urm6Qt4AaABAg
ot3k3k_FTgU,Thank you!!love it 😊🌹,Thank you!!love it 😊🌹,Rosa Angela,https://yt3.ggpht.com/ytc/AGIKgqM-OSF3nCi93SP3CGZI6RlCRvIDxe2AMgcq_PwFGQ=s48-c-k-c0x00ffffff-no-rj,http://www.youtube.com/channel/UCIlD_7inc4keeRbWufxuYeg,{'value': 'UCIlD_7inc4keeRbWufxuYeg'},True,none,1,2023-02-18T04:05:56Z,2023-02-18T04:05:56Z,,UgyqhhSacHy-rw1Q9AR4AaABAg
ot3k3k_FTgU,"Chopin, işitsel yolculuğun doruklarını, asırlara<br>değerli zarfın içinde bir mektupla auroralar eşiğinde, görselliğini zihinde yaşayarak, okyanusun diplerine ulaştırmış. Değerli sanat sevicileri olarak vals etmek, eşsiz emeğin kahramanı olur. Yaşatmak bu olsa gerek, evrenin sonsuzluğuna.","Chopin, işitsel yolculuğun doruklarını, asırlara
değerli zarfın içinde bir mektupla auroralar eşiğinde, görselliğini zihinde yaşayarak, okyanusun diplerine ulaştırmış. Değerli sanat sevicileri olarak vals etmek, eşsiz emeğin kahramanı olur. Yaşatmak bu olsa gerek, evrenin sonsuzluğuna.",AHBAP35,https://yt3.ggpht.com/Lw_m6rO192HV21sesCgzh43pPlOtXbfAfcPlXuiejJ-CSGRooYZmspr-YC6zLQNMBVmLBMmB=s48-c-k-c0x00ffffff-no-rj,http://www.youtube.com/channel/UC86mBBbR-O739pS_vUEaauA,{'value': 'UC86mBBbR-O739pS_vUEaauA'},True,none,3,2023-02-18T03:34:28Z,2023-02-18T03:35:25Z,,UgzHW_NH5tTwcebftkx4AaABAg
ot3k3k_FTgU,The tension between the notes used in ballet for tension between movements,The tension between the notes used in ballet for tension between movements,Ekaterina Akimenko,https://yt3.ggpht.com/ytc/AGIKgqNbjuqj1EFJJAsezGDICEjhxK92arl1Npbf7IUXM6c=s48-c-k-c0x00ffffff-no-rj,http://www.youtube.com/channel/UCRsfOVE8dmZM6noiK3AR2pg,{'value': 'UCRsfOVE8dmZM6noiK3AR2pg'},True,none,0,2023-02-18T02:53:11Z,2023-02-18T02:53:11Z,,UgwpP9mzHIEEMJXEJR14AaABAg
ot3k3k_FTgU,Used a lot in ballet,Used a lot in ballet,Ekaterina Akimenko,https://yt3.ggpht.com/ytc/AGIKgqNbjuqj1EFJJAsezGDICEjhxK92arl1Npbf7IUXM6c=s48-c-k-c0x00ffffff-no-rj,http://www.youtube.com/channel/UCRsfOVE8dmZM6noiK3AR2pg,{'value': 'UCRsfOVE8dmZM6noiK3AR2pg'},True,none,0,2023-02-18T02:51:04Z,2023-02-18T02:51:04Z,,Ugwzfho2bAIGueZ8J5B4AaABAg
ot3k3k_FTgU,"Someone know why he name em nocturnas , he did them  by night? Or something?","Someone know why he name em nocturnas , he did them  by night? Or something?",rine303,https://yt3.ggpht.com/ytc/AGIKgqMBiBWcwny7Q-6iWWI_8EAZSCCBcghVJY-rjFfiOA=s48-c-k-c0x00ffffff-no-rj,http://www.youtube.com/channel/UCBkk2jp6dv2VKQ_G8mGAqpg,{'value': 'UCBkk2jp6dv2VKQ_G8mGAqpg'},True,none,0,2023-02-18T00:45:53Z,2023-02-18T00:45:53Z,,Ugy7QYbeTc2sJP79r8t4AaABAg
ot3k3k_FTgU,Lindo noturno  suave encantador é  um bálsamo   de luz que acalenta o nosso  Espírito  !!,Lindo noturno  suave encantador é  um bálsamo   de luz que acalenta o nosso  Espírito  !!,Teresinha Felipe,https://yt3.ggpht.com/ytc/AGIKgqMLrCdhlfZCHKkMWXBGUdw4OB9nHBx3TteNsw=s48-c-k-c0x00ffffff-no-rj,http://www.youtube.com/channel/UCO5_wL8geMmdzQEs2utmpAA,{'value': 'UCO5_wL8geMmdzQEs2utmpAA'},True,none,7,2023-02-17T23:52:00Z,2023-02-17T23:52:00Z,,UgyOVbXHxhJQntB1fF94AaABAg
ot3k3k_FTgU,Forever enshrined by doc holiday off tombstone.,Forever enshrined by doc holiday off tombstone.,Jeff Blackard,https://yt3.ggpht.com/ytc/AGIKgqOcrQgKQMNGsafLQLYNzcpiM2zBxZX9aaZN9A=s48-c-k-c0x00ffffff-no-rj,http://www.youtube.com/channel/UChNtDuR4diHtUyciLFrw54g,{'value': 'UChNtDuR4diHtUyciLFrw54g'},True,none,2,2023-02-17T23:12:12Z,2023-02-17T23:12:12Z,,UgzYOawiXhKSS3x2Att4AaABAg
ot3k3k_FTgU,"FANTASTIC CHOPIN MUSIC, MY FAVORITE, ALL BEAUTIFUL, THANK YOU ❤️❤️🎹❤️😍🎶😘","FANTASTIC CHOPIN MUSIC, MY FAVORITE, ALL BEAUTIFUL, THANK YOU ❤️❤️🎹❤️😍🎶😘",Krasnaja Prkusic,https://yt3.ggpht.com/ytc/AGIKgqMiGkm17CT63nsjbEtUf0JKlOi7tw0NNWNAEC8ilg=s48-c-k-c0x00ffffff-no-rj,http://www.youtube.com/channel/UCQvC-R6ew4iWCdNZYjRFL1g,{'value': 'UCQvC-R6ew4iWCdNZYjRFL1g'},True,none,2,2023-02-17T11:15:27Z,2023-02-17T11:15:27Z,,UgybPuG14EkAd82smid4AaABAg
ot3k3k_FTgU,Beautiful!!,Beautiful!!,Relaxamento Vital,https://yt3.ggpht.com/ehgrKtVahbzxc1_6gmqGw95w02JqNZFyrRtXUcRjxZ4weqp94Bi0lqiT5XeDGQXLfuu4sDuayQ=s48-c-k-c0x00ffffff-no-rj,http://www.youtube.com/channel/UC-y-MFcfv9bg8rutij17DMg,{'value': 'UC-y-MFcfv9bg8rutij17DMg'},True,none,2,2023-02-17T11:07:19Z,2023-02-17T11:07:19Z,,UgyJXwJ8GIz2NMwXFx14AaABAg
ot3k3k_FTgU,Amazing wonderful to listen to😘,Amazing wonderful to listen to😘,Rene' Conrad Frederiksen,https://yt3.ggpht.com/ytc/AGIKgqOmWjhn1Mho66FkkotrUgo0GNlm9-YUA1USh8kTfg=s48-c-k-c0x00ffffff-no-rj,http://www.youtube.com/channel/UCqzDDgru7Os_hcBnYNadobw,{'value': 'UCqzDDgru7Os_hcBnYNadobw'},True,none,3,2023-02-17T06:17:49Z,2023-02-17T06:17:49Z,,UgxiDWWsA-W5trjH9oB4AaABAg
ot3k3k_FTgU,"<a href=""https://www.youtube.com/watch?v=ot3k3k_FTgU&amp;t=4m16s"">4:16</a>min.. tiene algo que me atrapa, no se como describirlo ...tratare de decirlo igual, pero sonara tonto quizás. Me hace despertar una mueca de sonrisa (físicamente) y tratar de recordar un &quot;recuerdo&quot; que no se si es tal (psíquicamente), y uniendo ambas cosas me deja totalmente desconcertado y hipnotizado en un tono mental &quot;casi de aprendizaje por alguien que admiraba de pequeño&quot;, quizás sea &quot;embrujo&quot; la palabra que mas contextualice mis sensaciones pero quería ser  mas racional al expresarme .. .caí de casualidad en el canal hermosos <a href=""https://www.youtube.com/watch?v=ot3k3k_FTgU&amp;t=56m58s"">56:58</a> min.gracias","4:16min.. tiene algo que me atrapa, no se como describirlo ...tratare de decirlo igual, pero sonara tonto quizás. Me hace despertar una mueca de sonrisa (físicamente) y tratar de recordar un ""recuerdo"" que no se si es tal (psíquicamente), y uniendo ambas cosas me deja totalmente desconcertado y hipnotizado en un tono mental ""casi de aprendizaje por alguien que admiraba de pequeño"", quizás sea ""embrujo"" la palabra que mas contextualice mis sensaciones pero quería ser  mas racional al expresarme .. .caí de casualidad en el canal hermosos 56:58 min.gracias",Damian garrido,https://yt3.ggpht.com/ytc/AGIKgqMpQMcwlyO3ORkCDZw-bRr1ky8vxPLa9C2Hcs2rzg=s48-c-k-c0x00ffffff-no-rj,http://www.youtube.com/channel/UC5oYWH4GSc7OVdF6xXmpB7w,{'value': 'UC5oYWH4GSc7OVdF6xXmpB7w'},True,none,1,2023-02-17T04:29:13Z,2023-02-17T04:31:54Z,,UgyUvtEMx1GXx2fJuSZ4AaABAg
ot3k3k_FTgU,"<a href=""https://www.youtube.com/watch?v=ot3k3k_FTgU&amp;t=35m11s"">35:11</a> typical chopin chords, love that","35:11 typical chopin chords, love that",Tyler Ace,https://yt3.ggpht.com/ytc/AGIKgqOAZthL2XP34sQ5rdPrvQSl_IUMe-HkxBOojHfy=s48-c-k-c0x00ffffff-no-rj,http://www.youtube.com/channel/UCk7PGIenw1Sq35u_IOONJXQ,{'value': 'UCk7PGIenw1Sq35u_IOONJXQ'},True,none,5,2023-02-16T21:54:35Z,2023-02-16T21:54:35Z,,Ugz4L9Xm7cw3ApuLxe94AaABAg
ot3k3k_FTgU,とっても素敵な音楽ですね。心が落ち着きます。,とっても素敵な音楽ですね。心が落ち着きます。,クリームパピヨン,https://yt3.ggpht.com/ytc/AGIKgqOFHeyXkc1yzDxFG-k3h1yRLruGwpXX-Ti6PqUgEQ=s48-c-k-c0x00ffffff-no-rj,http://www.youtube.com/channel/UC3rwbkWH-rjbNYb9WHMD8tw,{'value': 'UC3rwbkWH-rjbNYb9WHMD8tw'},True,none,3,2023-02-16T20:50:51Z,2023-02-16T20:50:51Z,,UgxdBGnH3W1tf-KsDTx4AaABAg
ot3k3k_FTgU,"<a href=""https://www.youtube.com/watch?v=ot3k3k_FTgU&amp;t=3m39s"">3:39</a>",3:39,Janete Fonseca gimenes,https://yt3.ggpht.com/ytc/AGIKgqPp-fz4HUV5eMCRUVRtC3QrsBI7e5ZmbQ6VvA=s48-c-k-c0x00ffffff-no-rj,http://www.youtube.com/channel/UCA3Rmuwc540eLAltMlJWF1g,{'value': 'UCA3Rmuwc540eLAltMlJWF1g'},True,none,0,2023-02-16T20:37:47Z,2023-02-16T20:38:05Z,,UgxO7AE-r84GNtMU37J4AaABAg
ot3k3k_FTgU,you just started to listen to music everything else was just noise,you just started to listen to music everything else was just noise,Edward Stripp,https://yt3.ggpht.com/ytc/AGIKgqNcoKI5oBf9jouQ50gVWlW6Q70PgJ0Z-x7_WnUoMQ=s48-c-k-c0x00ffffff-no-rj,http://www.youtube.com/channel/UCqCgWMFKjLxzsH_i248IjxQ,{'value': 'UCqCgWMFKjLxzsH_i248IjxQ'},True,none,5,2023-02-23T04:52:47Z,2023-02-23T04:52:47Z,,UgwqGyOFhUoLfr_eupt4AaABAg.9mCf-ZF58HB9mT-qKyOmKo
ot3k3k_FTgU,Sublime.... sin mas que decir !!!!!,Sublime.... sin mas que decir !!!!!,MP renders,https://yt3.ggpht.com/xvEkidYTAGXR2Aw35cazRGbthw_aYaHnlZcpSaMhDobGtvQD-r13Int2FSPsqytD0xRm56r43w=s48-c-k-c0x00ffffff-no-rj,http://www.youtube.com/channel/UCUjqHFCjjB7I01gG0w0pBwA,{'value': 'UCUjqHFCjjB7I01gG0w0pBwA'},True,none,2,2023-02-16T20:29:59Z,2023-02-16T20:29:59Z,,UgyptivVCaQ-sI1kplZ4AaABAg
ot3k3k_FTgU,I don&#39;t know about the others but the second Nocturne was played so badly lol,I don't know about the others but the second Nocturne was played so badly lol,B M,https://yt3.ggpht.com/ytc/AGIKgqN9tokSWzsIJ6QGPbRJu-30w5KNDYdBQAJYcw=s48-c-k-c0x00ffffff-no-rj,http://www.youtube.com/channel/UCLbGSLg9z0bs989sGk2FRdA,{'value': 'UCLbGSLg9z0bs989sGk2FRdA'},True,none,0,2023-02-16T18:14:24Z,2023-02-16T18:14:24Z,,UgzaZmSECM46zcuA4tV4AaABAg
ot3k3k_FTgU,"Jesus lоves yоu, and is here fоr yоu. “Now, therefore,” says the LORD, “turn to Me with all your heart, with fasting, with weeping, and with mourning.” Joel <a href=""https://www.youtube.com/watch?v=ot3k3k_FTgU&amp;t=2m12s"">2:12</a>","Jesus lоves yоu, and is here fоr yоu. “Now, therefore,” says the LORD, “turn to Me with all your heart, with fasting, with weeping, and with mourning.” Joel 2:12",Andrew,https://yt3.ggpht.com/nLxi2_EarXfBY2f-BxmKzKWI7G0QJuAfnQBlkNxZvfv5Ym_TqnWgkUYAJiwzbPjAmU4kcxv2Yg=s48-c-k-c0x00ffffff-no-rj,http://www.youtube.com/channel/UCtNeGIEhF1rEwyUL3kjzTTA,{'value': 'UCtNeGIEhF1rEwyUL3kjzTTA'},True,none,0,2023-02-17T18:48:53Z,2023-02-17T18:48:53Z,,Ugy6nizr8EpNAt6JZe54AaABAg.9mCMIe2qTPl9mF2kt7uIKw
ot3k3k_FTgU,&lt;-&lt;--&lt;-&lt;-&lt;-&lt;--tarumlüg rutangisnetauq Programmierer der Master K. I.,<-<--<-<-<-<--tarumlüg rutangisnetauq Programmierer der Master K. I.,Mc Fly,https://yt3.ggpht.com/ytc/AGIKgqNRawY6oAMTfZ6AJdasp7toF-eU7ZMTI9XROg=s48-c-k-c0x00ffffff-no-rj,http://www.youtube.com/channel/UCIUpgboKQs7JlC9gzLBNf9w,{'value': 'UCIUpgboKQs7JlC9gzLBNf9w'},True,none,0,2023-02-16T17:21:41Z,2023-02-16T17:21:41Z,,Ugz98XhFZhKWIFrYOCB4AaABAg
ot3k3k_FTgU,👏❤,👏❤,ricardo gimenez,https://yt3.ggpht.com/ytc/AGIKgqPv1sDy6R07UH1Tim3UPP6kQEJW3Srdhuz7xpVV=s48-c-k-c0x00ffffff-no-rj,http://www.youtube.com/channel/UC9E3023WvvVXhziTj7ZsyMg,{'value': 'UC9E3023WvvVXhziTj7ZsyMg'},True,none,0,2023-02-16T14:28:33Z,2023-02-16T14:28:33Z,,Ugxoa7xWKDajSidmlN54AaABAg
ot3k3k_FTgU,👏 😂  totally!,👏 😂  totally!,Classical Oasis,https://yt3.ggpht.com/JS7TE4cCbhWgK6E1qAbbQecDqgYh_FzdykaknewcLqlRaTBZN4ECPUB0cjnvxZ0o5dKZRRI-=s48-c-k-c0x00ffffff-no-rj,http://www.youtube.com/channel/UCzo-s-TNyLPq41bW7VUDQ0w,{'value': 'UCzo-s-TNyLPq41bW7VUDQ0w'},True,none,1,2023-02-17T17:15:47Z,2023-02-17T17:15:47Z,,UgzYt3hSYSHUFqdOyUh4AaABAg.9mBZm80-hRK9mEt6-rZZHh
ot3k3k_FTgU,Beethoven is far way better,Beethoven is far way better,Karaoke,https://yt3.ggpht.com/ytc/AGIKgqNcVCrEb2PPYn-eS5e0AwaBlR90NijOSrqe3TES4bbeDpY71STTblSls0ZQN7N2=s48-c-k-c0x00ffffff-no-rj,http://www.youtube.com/channel/UCR0GL2K5e7YZApgUUzRzt-A,{'value': 'UCR0GL2K5e7YZApgUUzRzt-A'},True,none,0,2023-02-16T08:14:48Z,2023-02-16T08:14:48Z,,UgxtfTfhcRMr-bHhoB14AaABAg
ot3k3k_FTgU,"Jesus loves you, and is here for you. “Now, therefore,” says the LORD, “turn to Me with all your heart, with fasting, with weeping, and with mourning.” Joel <a href=""https://www.youtube.com/watch?v=ot3k3k_FTgU&amp;t=2m12s"">2:12</a>","Jesus loves you, and is here for you. “Now, therefore,” says the LORD, “turn to Me with all your heart, with fasting, with weeping, and with mourning.” Joel 2:12",Andrew,https://yt3.ggpht.com/nLxi2_EarXfBY2f-BxmKzKWI7G0QJuAfnQBlkNxZvfv5Ym_TqnWgkUYAJiwzbPjAmU4kcxv2Yg=s48-c-k-c0x00ffffff-no-rj,http://www.youtube.com/channel/UCtNeGIEhF1rEwyUL3kjzTTA,{'value': 'UCtNeGIEhF1rEwyUL3kjzTTA'},True,none,1,2023-02-17T18:45:06Z,2023-02-17T18:45:06Z,,Ugz0QjXX-88aQZzAF1t4AaABAg.9mAa5vrPTLc9mF2KCXcMzq
ot3k3k_FTgU,The sound is phenomenal !,The sound is phenomenal !,J Gamez,https://yt3.ggpht.com/ytc/AGIKgqNwbHMltNgvfaEtD-lN98RjN9eoZgwNTVgFVw=s48-c-k-c0x00ffffff-no-rj,http://www.youtube.com/channel/UCdziH4EVXQ2e7i5RVZZillw,{'value': 'UCdziH4EVXQ2e7i5RVZZillw'},True,none,4,2023-02-15T21:39:20Z,2023-02-15T21:39:20Z,,UgxgtGEVb8x4hDdBjTZ4AaABAg
ot3k3k_FTgU,"Nuevamente tu y yo junto a Chopin, la música nos regresa a la calma y nos envuelve amorosamente. Si por casualidad no me has besado en tu partida , no te preocupes, ya que como flores sobre mi cama han caído las notas de Nocturna. Chopin lo ha hecho.","Nuevamente tu y yo junto a Chopin, la música nos regresa a la calma y nos envuelve amorosamente. Si por casualidad no me has besado en tu partida , no te preocupes, ya que como flores sobre mi cama han caído las notas de Nocturna. Chopin lo ha hecho.",Patricia Duran,https://yt3.ggpht.com/ytc/AGIKgqNUzLC-3mmywz8HNmtGpv7i975cXF8YBPcTuFz1gA=s48-c-k-c0x00ffffff-no-rj,http://www.youtube.com/channel/UCw6yjcU9zPtINwDGdAb-38Q,{'value': 'UCw6yjcU9zPtINwDGdAb-38Q'},True,none,1,2023-02-15T19:52:33Z,2023-02-15T19:52:33Z,,UgxAJDpKb9wy343Ms4d4AaABAg
ot3k3k_FTgU,I used to play this Nocturne as a pre- teen. Sweet memories. Am now 88.5! Thank God!,I used to play this Nocturne as a pre- teen. Sweet memories. Am now 88.5! Thank God!,Theodore Ruiz,https://yt3.ggpht.com/ytc/AGIKgqPzuC4QgYbOBQ4xWnpTPU--g5DeBvRXhCagtV8V-pmqALcOHKLww1vGYYP6bG2E=s48-c-k-c0x00ffffff-no-rj,http://www.youtube.com/channel/UCbEOjnBJnc5Wa2qjglzcltw,{'value': 'UCbEOjnBJnc5Wa2qjglzcltw'},True,none,1,2023-02-15T19:04:51Z,2023-02-15T19:04:51Z,,Ugx1If9_JmCJ-a6LAIB4AaABAg
ot3k3k_FTgU,Μπράβο ! ! !,Μπράβο ! ! !,ΑΠΟΣΤΟΛΗΣ ΜΑΡΟΥΛΑΚΗΣ,https://yt3.ggpht.com/ytc/AGIKgqOWVlRqfG2heCtBzzw6DSG3FXLYrT0Y9QsryfPqkMX2xAhVxvujUd0UKvSGwMabZg=s48-c-k-c0x00ffffff-no-rj,http://www.youtube.com/channel/UCXzta7nofukhM-29HVMvvZQ,{'value': 'UCXzta7nofukhM-29HVMvvZQ'},True,none,0,2023-02-15T16:05:44Z,2023-02-15T16:05:44Z,,Ugyr3knGrByvn61WbSx4AaABAg
ot3k3k_FTgU,"La musique est salutaire quand elle suscite une émotion ou une humeur en vous. il ne s&#39;agit pas nécessairement d&#39;être mélodique, religieux ou ouvertement musical, mais plutôt de transporter l&#39;auditeur quelque part où il n&#39;était pas avant. Dans ce cas précis, j&#39;ai l&#39;impression d&#39;être assis sur un banc de cimetière par une tiède soirée. le vent me caresse doucement le visage, et tout est silencieux à part la nature qui m&#39;entoure 🙂","La musique est salutaire quand elle suscite une émotion ou une humeur en vous. il ne s'agit pas nécessairement d'être mélodique, religieux ou ouvertement musical, mais plutôt de transporter l'auditeur quelque part où il n'était pas avant. Dans ce cas précis, j'ai l'impression d'être assis sur un banc de cimetière par une tiède soirée. le vent me caresse doucement le visage, et tout est silencieux à part la nature qui m'entoure 🙂",Philippe Cirse,https://yt3.ggpht.com/ytc/AGIKgqO4mMmd_n14hbDPqfBtjBD_m2Mr0XxF5Xx1xEOLVg=s48-c-k-c0x00ffffff-no-rj,http://www.youtube.com/channel/UCmZIhyXDlDLe2oB_pmbFkmA,{'value': 'UCmZIhyXDlDLe2oB_pmbFkmA'},True,none,1,2023-02-15T14:57:37Z,2023-02-15T14:57:37Z,,UgxwxZuhE0QlNmyKpkB4AaABAg
ot3k3k_FTgU,Thanks for video,Thanks for video,Relax Planet,https://yt3.ggpht.com/N7TSsVbzYTZVamrw66b1KJ86x5uC8lU2CeW2YdI6oG6vv1Bp4TKvuO8xBKp_blrDR1431ig12w=s48-c-k-c0x00ffffff-no-rj,http://www.youtube.com/channel/UCX-Vwimsc3Z3D_oe8nhMbmw,{'value': 'UCX-Vwimsc3Z3D_oe8nhMbmw'},True,none,0,2023-02-15T14:33:43Z,2023-02-15T14:33:43Z,,UgyToB0lOrVJJdXExdJ4AaABAg
ot3k3k_FTgU,Incanto senza fine! (încântare fără sfârșit!),Incanto senza fine! (încântare fără sfârșit!),Viorica Bălteanu,https://yt3.ggpht.com/ytc/AGIKgqNkmi5dkO3L1PwO3ZYpkU_eJg3WfAG8wjnWaLa3zA=s48-c-k-c0x00ffffff-no-rj,http://www.youtube.com/channel/UCPSQW6_-SMymOyWWmHVgbdw,{'value': 'UCPSQW6_-SMymOyWWmHVgbdw'},True,none,1,2023-02-15T13:18:36Z,2023-02-15T13:18:36Z,,UgySDT6AOvBxSVNPsTl4AaABAg
ot3k3k_FTgU,There are no performers... read disc,There are no performers... read disc,memet3m,https://yt3.ggpht.com/ytc/AGIKgqNpwVuEGKH4v2XTQtkAjql2eeSMSFkeW0w8XUhPYQ=s48-c-k-c0x00ffffff-no-rj,http://www.youtube.com/channel/UC6YmJDwwG20jTBwUMqQCk1g,{'value': 'UC6YmJDwwG20jTBwUMqQCk1g'},True,none,0,2023-02-16T23:11:41Z,2023-02-16T23:11:41Z,,UgzFehcLeYFNzQeNP_N4AaABAg.9m96s5CBNyG9mCx1jw4fpW
ot3k3k_FTgU,"Nocturne in E-Flat Major is not nicely played. It&#39;s like the pianist could decide on fast or slow, then left and right hand aren&#39;t together.<br>Please could you change and find a different recording.","Nocturne in E-Flat Major is not nicely played. It's like the pianist could decide on fast or slow, then left and right hand aren't together.
Please could you change and find a different recording.",Pierre van Wyk,https://yt3.ggpht.com/ytc/AGIKgqOMg2Q_5e7u7YL6F6KY0CaJ6nE_eBoq4qvdTQ=s48-c-k-c0x00ffffff-no-rj,http://www.youtube.com/channel/UCpweFDHDV8Dcb7I0Zu9UTWg,{'value': 'UCpweFDHDV8Dcb7I0Zu9UTWg'},True,none,0,2023-02-15T10:55:59Z,2023-02-15T10:55:59Z,,UgyL-gMLI_Vb_sYcVBN4AaABAg
ot3k3k_FTgU,SUPPORT HUMAN ARTISTS,SUPPORT HUMAN ARTISTS,MirA,https://yt3.ggpht.com/ytc/AGIKgqOd5czpTAgbNAIaf90nNy5pfrSDjuRjkmdEL1vpEtXyHN1WDWMBOKeo6YGPPC6-=s48-c-k-c0x00ffffff-no-rj,http://www.youtube.com/channel/UC-1AG_mTIJhICHiVw08-FGg,{'value': 'UC-1AG_mTIJhICHiVw08-FGg'},True,none,0,2023-02-15T04:50:03Z,2023-02-15T04:50:03Z,,UgwOrMfSpxpGrC6mV9R4AaABAg
ot3k3k_FTgU,Amo a Chopin desde mi adolescencia  me recuerda a mi tiempo de universidad  y hermosamente es un músico favorito de mi hijo  mi hijo toca el piano el sólo aprendió y Chopin es uno de sus favoritos Mozart y Beethoven  y Bach,Amo a Chopin desde mi adolescencia  me recuerda a mi tiempo de universidad  y hermosamente es un músico favorito de mi hijo  mi hijo toca el piano el sólo aprendió y Chopin es uno de sus favoritos Mozart y Beethoven  y Bach,Maria Cabrera,https://yt3.ggpht.com/ytc/AGIKgqPJaOkeI_sckw9Zti8eCRRuuVrFYu7CysqqjQ=s48-c-k-c0x00ffffff-no-rj,http://www.youtube.com/channel/UC2I9k8UDId18HS0CwK15JZQ,{'value': 'UC2I9k8UDId18HS0CwK15JZQ'},True,none,28,2023-02-15T01:02:50Z,2023-02-15T01:02:50Z,,UgyCv2Qts7147fkWM714AaABAg
ot3k3k_FTgU,&quot;Poetry is the rhythmic creation of beauty in words.&quot;<br>Edgar Allan Poe,"""Poetry is the rhythmic creation of beauty in words.""
Edgar Allan Poe",Música Clássica Erudita,https://yt3.ggpht.com/Y5vxtbwthMwkYHRXwnlKRakAmrPS7WvR0gjU6zPMbLcI1CP8Re0oA8PruBIMBUhvt-6zgqxSFg=s48-c-k-c0x00ffffff-no-rj,http://www.youtube.com/channel/UC5DgMajtFsQwQ7SJQCtvyQA,{'value': 'UC5DgMajtFsQwQ7SJQCtvyQA'},True,none,2,2023-02-14T12:54:12Z,2023-02-14T12:54:12Z,,Ugx-h1Riyh4WnkeLVCZ4AaABAg
ot3k3k_FTgU,Nádhera. Úžasná hudba.,Nádhera. Úžasná hudba.,Susanne Olejníková,https://yt3.ggpht.com/ytc/AGIKgqMGLe06eg4Z1H6_cKhRzf63UMzQIbCLebLWG5v8dg7FbkXt30g_qFJHSosbMYJ1=s48-c-k-c0x00ffffff-no-rj,http://www.youtube.com/channel/UCm3uqJQ33Q_s9GgGiG791mg,{'value': 'UCm3uqJQ33Q_s9GgGiG791mg'},True,none,1,2023-02-14T12:09:05Z,2023-02-14T12:09:05Z,,UgwgJxmMITgLCXeEDMt4AaABAg
ot3k3k_FTgU,TÜRKİYE,TÜRKİYE,Berkan Özdemir,https://yt3.ggpht.com/ytc/AGIKgqPYX4LaBZI2_z1Pg4HfV02_0Ym7hv8VxsAhrIqXng=s48-c-k-c0x00ffffff-no-rj,http://www.youtube.com/channel/UCHRbZGB7TMzrEBU9AYdsVLQ,{'value': 'UCHRbZGB7TMzrEBU9AYdsVLQ'},True,none,2,2023-02-14T10:47:55Z,2023-02-14T10:47:55Z,,UgxVEdGg_04lLMX0xeZ4AaABAg
ot3k3k_FTgU,👍👍,👍👍,JUNIOR,https://yt3.ggpht.com/JfVOoweGVPEy6EUwYcvEeosOYZE3sDKVMpW9Mgh_eg-LwNDF0gAFia-ZQNZ30KmaHsDpVsJuLA=s48-c-k-c0x00ffffff-no-rj,http://www.youtube.com/channel/UCMs_t2xFgj0W4Mm6jfy1EFg,{'value': 'UCMs_t2xFgj0W4Mm6jfy1EFg'},True,none,1,2023-02-14T10:32:56Z,2023-02-14T10:32:56Z,,Ugy7J_R6HxyRq1fJGeJ4AaABAg
ot3k3k_FTgU,راسلتك خاص,راسلتك خاص,𓍲حاء&ميم~,https://yt3.ggpht.com/TRzaIYN_VzhRUuXrw6NF8gcB5QzlGzd1PUKTblgiK3u8IQoQViucbs4AgM7EXPquOHpyuU8-EOo=s48-c-k-c0x00ffffff-no-rj,http://www.youtube.com/channel/UCYk-GD_YaI9nrzmq8D6NUVw,{'value': 'UCYk-GD_YaI9nrzmq8D6NUVw'},True,none,1,2023-02-16T11:24:27Z,2023-02-16T11:24:27Z,,Ugzllpko8UuHwQleXOd4AaABAg.9m6PuVu7M3h9mBg5qORWZ0
ot3k3k_FTgU,@سيد المطر 🌧 مبيها تشوفني فكر ههه و نحس عليها ضايجه مني,@سيد المطر 🌧 مبيها تشوفني فكر ههه و نحس عليها ضايجه مني,𓍲حاء&ميم~,https://yt3.ggpht.com/TRzaIYN_VzhRUuXrw6NF8gcB5QzlGzd1PUKTblgiK3u8IQoQViucbs4AgM7EXPquOHpyuU8-EOo=s48-c-k-c0x00ffffff-no-rj,http://www.youtube.com/channel/UCYk-GD_YaI9nrzmq8D6NUVw,{'value': 'UCYk-GD_YaI9nrzmq8D6NUVw'},True,none,1,2023-02-16T10:49:35Z,2023-02-16T10:49:35Z,,Ugzllpko8UuHwQleXOd4AaABAg.9m6PuVu7M3h9mBc6YcrJfC
